{
 "$schema": "https://creditia.dev/schema/v0.json",
 "breakdown": [
  {
   "byArea": {
    "core": 83,
    "docs": 34,
    "tests": 19
   },
   "byEvidence": {
    "declared": {
     "linesAdded": 0
    },
    "inferred": {
     "linesAdded": 0
    },
    "manual": {
     "linesAdded": 0
    },
    "unattributed": {
     "linesAdded": 136
    },
    "verified": {
     "linesAdded": 0
    }
   },
   "byVersion": {
    "unreleased": 136
   },
   "contributor": "unattributed",
   "linesAdded": 136,
   "linesSurviving": 100
  },
  {
   "byArea": {
    "assets": 9,
    "build": 328,
    "core": 10262,
    "docs": 252,
    "frontend": 335,
    "tests": 442
   },
   "byEvidence": {
    "declared": {
     "linesAdded": 11628
    },
    "inferred": {
     "linesAdded": 0
    },
    "manual": {
     "linesAdded": 0
    },
    "unattributed": {
     "linesAdded": 0
    },
    "verified": {
     "linesAdded": 0
    }
   },
   "byVersion": {
    "unreleased": 11628
   },
   "contributor": "a:claude-code/claude-fable-5-1",
   "linesAdded": 11628,
   "linesSurviving": 7068
  },
  {
   "byArea": {
    "core": 46,
    "frontend": 110
   },
   "byEvidence": {
    "declared": {
     "linesAdded": 156
    },
    "inferred": {
     "linesAdded": 0
    },
    "manual": {
     "linesAdded": 0
    },
    "unattributed": {
     "linesAdded": 0
    },
    "verified": {
     "linesAdded": 0
    }
   },
   "byVersion": {
    "unreleased": 156
   },
   "contributor": "a:claude-code",
   "linesAdded": 156,
   "linesSurviving": 145
  },
  {
   "byArea": {
    "assets": 171,
    "build": 340,
    "core": 11973,
    "docs": 651,
    "frontend": 5602,
    "tests": 3405
   },
   "byEvidence": {
    "declared": {
     "linesAdded": 126
    },
    "inferred": {
     "linesAdded": 15457
    },
    "manual": {
     "linesAdded": 0
    },
    "unattributed": {
     "linesAdded": 0
    },
    "verified": {
     "linesAdded": 6559
    }
   },
   "byVersion": {
    "unreleased": 22142
   },
   "contributor": "a:claude-code/claude-opus-5-5",
   "linesAdded": 22142,
   "linesSurviving": 18109
  }
 ],
 "clock": [
  [
   0,
   0,
   0,
   0,
   0,
   0,
   0,
   0,
   0,
   0,
   0,
   0,
   0,
   0,
   0,
   0,
   1,
   2,
   3,
   0,
   0,
   0,
   0,
   3
  ],
  [
   2,
   1,
   1,
   1,
   2,
   1,
   1,
   0,
   0,
   0,
   0,
   0,
   2,
   4,
   2,
   1,
   0,
   0,
   0,
   0,
   0,
   0,
   0,
   0
  ],
  [
   0,
   0,
   0,
   0,
   0,
   0,
   0,
   0,
   0,
   0,
   0,
   0,
   0,
   0,
   0,
   0,
   0,
   0,
   0,
   0,
   0,
   0,
   0,
   0
  ],
  [
   0,
   0,
   0,
   0,
   0,
   0,
   0,
   0,
   0,
   0,
   0,
   0,
   0,
   0,
   0,
   0,
   0,
   0,
   0,
   0,
   0,
   0,
   0,
   0
  ],
  [
   0,
   0,
   0,
   0,
   0,
   0,
   0,
   0,
   0,
   0,
   0,
   0,
   0,
   0,
   0,
   0,
   0,
   0,
   0,
   0,
   0,
   0,
   0,
   0
  ],
  [
   3,
   0,
   0,
   0,
   0,
   0,
   0,
   0,
   0,
   0,
   0,
   2,
   0,
   0,
   0,
   2,
   0,
   4,
   0,
   0,
   0,
   0,
   0,
   0
  ],
  [
   0,
   0,
   0,
   0,
   0,
   0,
   0,
   0,
   0,
   0,
   0,
   0,
   0,
   0,
   0,
   4,
   0,
   0,
   0,
   0,
   0,
   0,
   0,
   0
  ]
 ],
 "conflictLines": 0,
 "contributors": [
  {
   "id": "unattributed",
   "kind": "unattributed",
   "roles": []
  },
  {
   "family": "anthropic",
   "harness": "claude-code",
   "id": "a:claude-code/claude-fable-5-1",
   "kind": "agent",
   "model": "claude-fable-5-1",
   "roles": [
    "author"
   ],
   "where": "local"
  },
  {
   "family": null,
   "harness": "claude-code",
   "id": "a:claude-code",
   "kind": "agent",
   "model": null,
   "roles": [
    "author"
   ],
   "where": "local"
  },
  {
   "family": "anthropic",
   "harness": "claude-code",
   "id": "a:claude-code/claude-opus-5-5",
   "kind": "agent",
   "model": "claude-opus-5-5",
   "roles": [
    "author"
   ],
   "where": "local"
  }
 ],
 "coverage": [
  {
   "best": "verified",
   "from": "2026-10-10",
   "name": "2026-10",
   "to": "2026-10-13",
   "verifiedShare": 0.235
  }
 ],
 "days": [
  {
   "by": {
    "claude-code": 11628,
    "unattributed": 136
   },
   "date": "2026-10-10"
  },
  {
   "by": {
    "claude-code": 9281
   },
   "date": "2026-10-11"
  },
  {
   "by": {
    "claude-code": 6806
   },
   "date": "2026-10-12"
  },
  {
   "by": {
    "claude-code": 6211
   },
   "date": "2026-10-13"
  }
 ],
 "files": [
  {
   "by": {
    "claude-code": 1
   },
   "lines": 1,
   "path": ".github/readme/logo-dark.svg"
  },
  {
   "by": {
    "claude-code": 1
   },
   "lines": 1,
   "path": ".github/readme/logo-light.svg"
  },
  {
   "by": {
    "claude-code": 1
   },
   "lines": 1,
   "path": ".github/readme/logo/aider.svg"
  },
  {
   "by": {
    "claude-code": 1
   },
   "lines": 1,
   "path": ".github/readme/logo/claude-code.svg"
  },
  {
   "by": {
    "claude-code": 1
   },
   "lines": 1,
   "path": ".github/readme/logo/cline.svg"
  },
  {
   "by": {
    "claude-code": 1
   },
   "lines": 1,
   "path": ".github/readme/logo/codex.svg"
  },
  {
   "by": {
    "claude-code": 1
   },
   "lines": 1,
   "path": ".github/readme/logo/copilot.svg"
  },
  {
   "by": {
    "claude-code": 1
   },
   "lines": 1,
   "path": ".github/readme/logo/cursor.svg"
  },
  {
   "by": {
    "claude-code": 1
   },
   "lines": 1,
   "path": ".github/readme/logo/devin.svg"
  },
  {
   "by": {
    "claude-code": 1
   },
   "lines": 1,
   "path": ".github/readme/logo/gemini.svg"
  },
  {
   "by": {
    "claude-code": 1
   },
   "lines": 1,
   "path": ".github/readme/logo/grok.svg"
  },
  {
   "by": {
    "claude-code": 1
   },
   "lines": 1,
   "path": ".github/readme/logo/jules.svg"
  },
  {
   "by": {
    "claude-code": 1
   },
   "lines": 1,
   "path": ".github/readme/logo/kilo.svg"
  },
  {
   "by": {
    "claude-code": 1
   },
   "lines": 1,
   "path": ".github/readme/logo/kimi.svg"
  },
  {
   "by": {
    "claude-code": 1
   },
   "lines": 1,
   "path": ".github/readme/logo/opencode.svg"
  },
  {
   "by": {
    "claude-code": 1
   },
   "lines": 1,
   "path": ".github/readme/logo/qwen.svg"
  },
  {
   "by": {
    "claude-code": 1
   },
   "lines": 1,
   "path": ".github/readme/logo/roo.svg"
  },
  {
   "by": {
    "claude-code": 21
   },
   "lines": 21,
   "path": ".github/readme/map-dark-en.svg"
  },
  {
   "by": {
    "claude-code": 21
   },
   "lines": 21,
   "path": ".github/readme/map-dark.svg"
  },
  {
   "by": {
    "claude-code": 21
   },
   "lines": 21,
   "path": ".github/readme/map-light-en.svg"
  },
  {
   "by": {
    "claude-code": 21
   },
   "lines": 21,
   "path": ".github/readme/map-light.svg"
  },
  {
   "by": {
    "claude-code": 64
   },
   "lines": 64,
   "path": ".github/workflows/ci.yml"
  },
  {
   "by": {
    "claude-code": 45
   },
   "lines": 45,
   "path": ".github/workflows/pages.yml"
  },
  {
   "by": {
    "claude-code": 29
   },
   "lines": 29,
   "path": ".github/workflows/release.yml"
  },
  {
   "by": {
    "claude-code": 32,
    "unattributed": 3
   },
   "lines": 35,
   "path": ".gitignore"
  },
  {
   "by": {
    "claude-code": 102
   },
   "lines": 102,
   "path": "ATTRIBUTION.md"
  },
  {
   "by": {
    "claude-code": 1,
    "unattributed": 19
   },
   "lines": 20,
   "path": "CREDITS.md"
  },
  {
   "by": {
    "claude-code": 25
   },
   "lines": 25,
   "path": "Cargo.toml"
  },
  {
   "by": {
    "unattributed": 21
   },
   "lines": 21,
   "path": "LICENSE"
  },
  {
   "by": {
    "claude-code": 181
   },
   "lines": 181,
   "path": "README.en.md"
  },
  {
   "by": {
    "claude-code": 181
   },
   "lines": 181,
   "path": "README.md"
  },
  {
   "by": {
    "claude-code": 52
   },
   "lines": 52,
   "path": "action.yml"
  },
  {
   "by": {
    "claude-code": 39
   },
   "lines": 39,
   "path": "apps/desktop/index.html"
  },
  {
   "by": {
    "claude-code": 22
   },
   "lines": 22,
   "path": "apps/desktop/package.json"
  },
  {
   "by": {
    "claude-code": 24
   },
   "lines": 24,
   "path": "apps/desktop/src-tauri/Cargo.toml"
  },
  {
   "by": {
    "claude-code": 3
   },
   "lines": 3,
   "path": "apps/desktop/src-tauri/build.rs"
  },
  {
   "by": {
    "claude-code": 7
   },
   "lines": 7,
   "path": "apps/desktop/src-tauri/capabilities/default.json"
  },
  {
   "by": {
    "claude-code": 229
   },
   "lines": 229,
   "path": "apps/desktop/src-tauri/src/main.rs"
  },
  {
   "by": {
    "claude-code": 43
   },
   "lines": 43,
   "path": "apps/desktop/src-tauri/tauri.conf.json"
  },
  {
   "by": {
    "claude-code": 47
   },
   "lines": 47,
   "path": "apps/desktop/src/engine.ts"
  },
  {
   "by": {
    "claude-code": 54
   },
   "lines": 54,
   "path": "apps/desktop/src/fonts.ts"
  },
  {
   "by": {
    "claude-code": 91
   },
   "lines": 91,
   "path": "apps/desktop/src/kits.ts"
  },
  {
   "by": {
    "claude-code": 2
   },
   "lines": 2,
   "path": "apps/desktop/src/logo.ts"
  },
  {
   "by": {
    "claude-code": 437
   },
   "lines": 437,
   "path": "apps/desktop/src/main.ts"
  },
  {
   "by": {
    "claude-code": 172
   },
   "lines": 172,
   "path": "apps/desktop/src/style.css"
  },
  {
   "by": {
    "claude-code": 13
   },
   "lines": 13,
   "path": "apps/desktop/tools/core.mjs"
  },
  {
   "by": {
    "claude-code": 41
   },
   "lines": 41,
   "path": "apps/desktop/tools/fonts.mjs"
  },
  {
   "by": {
    "claude-code": 21
   },
   "lines": 21,
   "path": "apps/desktop/tools/icon.mjs"
  },
  {
   "by": {
    "claude-code": 43
   },
   "lines": 43,
   "path": "apps/desktop/vite.config.ts"
  },
  {
   "by": {
    "claude-code": 15
   },
   "lines": 15,
   "path": "crates/adapters/Cargo.toml"
  },
  {
   "by": {
    "claude-code": 213
   },
   "lines": 213,
   "path": "crates/adapters/src/claude.rs"
  },
  {
   "by": {
    "claude-code": 176
   },
   "lines": 176,
   "path": "crates/adapters/src/cline.rs"
  },
  {
   "by": {
    "claude-code": 178
   },
   "lines": 178,
   "path": "crates/adapters/src/codex.rs"
  },
  {
   "by": {
    "claude-code": 155
   },
   "lines": 155,